id,Name,Image URL,Trivia 1,Trivia 2,Trivia 3
250,Cave of the Three Eyed Raven,cave.png,"Where were Bran Stark, Hodor, and Meera and Jojen Reed attacked by wights?",Bran was guided to this place north of the wall after warging with a weirwood tree.,Some of the last Children of the Forest live here.
187,Craster's Keep,craster.png,Where do Karl and Rast lead a mutiny against the Night's Watch,Where was Jeor Mormont killed?,Where does a person who has many daughter-wives live?
188,Fist of the First Men,fist.jpg,Where did Jon Snow find a cache of Dragonglass weapons,This ancient ring fort was a useful campsite for the Night's Watch in wildling territory.,This hill provided a tactical vantage point to see the surrounding area and was a common fallback point for the rangers from the Night's Watch.
249,Hardhome,hardhome.jpg,Where is The Freefolk's most permanent settlement?,Where is the first village that was invaded by the White Walkers and wights?,Where did many of the surviving Freefolk from the Battle of Castle Black flee to after escaping capture by Stannis?
248,The Dreadfort,dreadfort.jpg,Where is the ancestral home of House Bolton?,Where would you find the flag of the flayed man flying?,Where did Theon become Reek?
148,Moat Cailin,moatcailin.png,Where is the long abandoned fortress that sits on The Neck and is a gateway to the North?,Where did Ramsay Bolton slaughter the Ironborn after promising them safe passage back to The Iron Islands?,This decrepit fortress built by the First Men still serves as a lynchpin in the defense of The North from southern invasion.
159,Winterfell,winterfell.jpg,Where is the ancestral seat of House Stark,Where is Bran pushed from a tower?,Where does The Battle of the Bastards take place?
234,Pyke,pyke.jpg,Where is the capital of The Iron Islands,Where is Theon Greyjoy from?,Where would you most avoid if you were scared of rope bridges?
132,Eyrie,eyrie.jpg,Where is the seat of house Arryn?,Where might someone be thrown out the Moon Door?,Where would you find Mord?
131,The Bloody Gate,bloodygate.png,Where would you find the entrance to The Vale?,Where do Arya Stark and The Hound learn about Lysa Arryn's death?,This Castle and gateway to the Vale is captained by Ser Donnel Waynwood
15,Harrenhal,harrenhal.jpg,Where is the largest castle in all of Westeros,"What castle were Arya Stark, Gendry, and Hot Pie taken to as prisoners?",This cursed keep has been ruled by at least 12 different houses.
38,Inn at the Crossroads,crossroads.jpg,This is where Catelyn Stark captures Tyrion Lannister,Where would you find Hot Pie's famous baked goods?,Mycah is killed while the Royal procession camps here on their way to King's Landing.
32,Riverrun,riverrun.jpg,This castle is the ancestral home to House Tully,"After siding with the Lannisters, what castle is Walder Frey given control of?",Sluice gates can be opened to turn this castle into an island.
145,The Twins,twins.jpg,Where is the ancestral home of House Frey?,This castle's bridge spans the width of the Green Fork of the Trident,"Where does Roose Bolton say ""Jaime Lannister sends his regards."""
251,Casterly Rock,casterly.png,This castle is the home of House Lannister,This castle sits on top of a gold mine,The Unsullied take this castle with far less resistance than they had been expecting.
72,Highgarden,highgarden.png,This house was long the home of House Tyrell,This castle is the region captial of The Reach,This castle is surrounded by golden roses and green fields
73,Horn Hill,hornhill.png,This castle is the home of House Tarly,Samwell Tarly was raised in this castle.,"After two recent fiery deaths, the ruler of this castle would be Talla, daughter and third child of Randyll and Melissa"
77,Oldtown,oldtown.png,Where is the oldest major city in Westeros?,This city is home to the Citadel and the order of maesters.,The aptly named House Hightower and their high tower are located in this ancient city. 
52,Storm's End,stormsend.jpg,Where is the ancestral home of House Baratheon,This castle was briefly held by King Renly Baratheon,This fortress is the capital of The Stormlands
197,Tarth,tarth.png,Brienne hails from this Island.,"Where is the ""Sapphire Isle?""",This Island's namesake house were bannermen of House Baratheon. Their seat is Evenfall Hall.
46,Dragonstone,dragonstone.png,"At the start of the series, this castle is held by Stannis Baratheon",Jon Snow seeks to mine Dragonglass from beneath this castle.,Aegon Targaryen I held this castle before conquering Westeros with his two sister-wives and fellow dragon riders. 
1,King's Landing,kingslanding.jpg,This city is the capital of Westeros,Where would you find the Iron Throne?,Davos Seaworth is from the slums of this city.
96,Sunspear,sunspear.jpg,This castle is the capital of Dorne.,This castle's long-time lord was relegated to a wheelchair by gout.,Where would you find guard captain Areo Hotah?
98,The Water Gardens,watergardens.png,"Prince Doran Martell spends much of his time at this palace, where he oversaw his daughters swimming with Myrcella Baratheon.",Ellaria Sand starts her coup of Dorne here.,This retreat is a respite in the desert located close to the capital of Dorne.
88,The Tower of Joy,towerjoy.jpg,"This fortress was the location of a battle between Ned Stark and his bannermen, and members of the Kingsguard, as ned saught to rescue his sister.","Arthur Dayne, ""The Sword of the Morning"" was killed here.",Bran's greensight shows him a vision of his father doing battle in the past at this fortification.
199,Braavos,braavos.jpg,A titan overlooks this Free City,This city is home to the world famous Iron Bank,"Before becoming Arya's teacher, Syrio Forel was First Sword in this city."
194,Pentos,pentos.png,"Prior to her marriage to Khal Drogo, Daenerys Targaryen was living in this city, in the home of Illyrio Mopatis.",This city is ruled by a council of ruthless Magisters in all but name.,"After fleeing King's Landing in a crate, Tyrion Lannister first arrives here."
209,Volantis,volantis.jpg,"A brothel in this Free City is the spot of a chance encounter between Tyrion, Varys, and a twice exiled Jorah Mormont.","This city contains ""The Long Bridge,"" which spans the mouth of the Rhoyne River",Talisa Stark is from this Free City.
224,Vaes Dothrak,dothrak.png,Where is the only permanent settlement in The Dothraki Sea?,The entrance to this city is marked by two massive bronze statues,"The Dosh Khaleen, widows of slain Khals reside in this city."
220,Astapor,astapor.jpg,Where are the Unsullied trained and sold?,"Daenerys is nearly assassinated using a manticore in this city, before being saved by Barriston Selmy.","Missandei was previously owned by Kraznys mo Nakloz, a slave trader in this city."
221,Yunkai,yunkai.png,This slave city is ruled by a group of oligarchs known as the Wise Masters.,"What city's leaders employed Daario Naharis, before he betrayed his contract to serve Daenerys?","This city's chief export are bedslaves trained in ""The Way of Seven Sighs."""
222,Meereen,meereen.png,This slaver city is marked by three massive pyramids.,The Great Pit of Daznak is located in this city. ,Where is Hizdahr zo Loraq from?
246,Qarth,qarth.jpg,What city is ruled by a group known as The Thirteen and a cabal of Warlocks?,Daenerys comes to this city after wandering with her Khalisar in the Red Wastes.,Xaro Xhoan Daxos seeks to be the king of this city.
166,Castle Black,castleblack.jpg,Where was Jon Snow Killed?,"This Castle is ruled not by a Lord, but a Lord Commander.",Daenerys' last living Great Uncle spent most of his life living at what castle?